candidate_id,source_file,table_name,n_rows,n_cols,id_column,unique_ids,duplicate_id_rows,treatment_column,treatment_levels,outcome_columns_sample,columns_sample,notes
RCTC-01367,rct_expansion/provenance/manual_review_user_files_2026_06_11/extracted/dataverse_files/Long_term_adoption_Dataverse.dta,Long_term_adoption_Dataverse.dta,1817,33,schid,31,1786,treatment,Treatment group=926; Control group=891,endown_sc; endown_sf; harmvision_end; nowearjun_end,male; schid; attrition; needgl; treatment; strata; classglass_base_sf; endown_sf; endown_sc; nowearjun_end; harmvision_end; teased2; distance; zmath; tsratio; grade7; log_totalst; tease_bully_bs; dadmigrant; LogMAR; ecst_LogMAR; hglass_bs; nglass_bs; mommigrant; dadjun; momjun; mildno_end; ratio_own_need; log_pocketm; ratio_peer_glass_end; price_glasses; ugly_end; non_help_end,Treatment is constant within 31 of 31 schools; schools with >1 treatment=0.
RCTC-01557_user_zip,rct_expansion/provenance/manual_review_user_files_2026_06_11/extracted/RCTC-01557/Long_term_adoption_Dataverse.dta,Long_term_adoption_Dataverse.dta,1817,33,schid,31,1786,treatment,Treatment group=926; Control group=891,endown_sc; endown_sf; harmvision_end,male; schid; attrition; needgl; treatment; strata; classglass_base_sf; endown_sf; endown_sc; nowearjun_end; harmvision_end; teased2; distance; zmath; tsratio; grade7; log_totalst; tease_bully_bs; dadmigrant; LogMAR; ecst_LogMAR; hglass_bs; nglass_bs; mommigrant; dadjun; momjun; mildno_end; ratio_own_need; log_pocketm; ratio_peer_glass_end; price_glasses; ugly_end; non_help_end,This file is byte-identical to the RCTC-01367 eyeglasses Stata file and does not match the expected music-intervention chemotherapy candidate.
RCTC-01557,rct_expansion/provenance/deferred_likely_qualified_evaluation_2026_06_11/source_verification_manual_review_queue/downloads/RCTC-01557/S 3 raw data.tab,S 3 raw data.tab,24,159,ID,24,0,group,1=12; 2=12,DASS1; DASS2; DASS3; DASS4; DASS5; DASS6; DASS7; DASS8; DASS9; DASS10; DASS11; DASS12; DASS13; DASS14; DASS15; DASS16; DASS17; DASS18; DASS19; DASS20; DASS21; GP1; GP2; GP3; GP4; GP5; GP6; GP7; GS1; GS2,ID; group; age; education; religion; place; job; marrige; income; diagnoseKmonth; diagnose; stage; typeoftreatment; chemotherapytime; regimennumber; DASS1; DASS2; DASS3; DASS4; DASS5; DASS6; DASS7; DASS8; DASS9; DASS10; DASS11; DASS12; DASS13; DASS14; DASS15; DASS16; DASS17; DASS18; DASS19; DASS20; DASS21; GP1; GP2; GP3; GP4; GP5; GP6; GP7; GS1; GS2; GS3; GS4; GS5; GS6; GS7; GE1; GE2; GE3; GE4; GE5; GE6; GF1; GF2; GF3; GF4; GF5; GF6; GF7; DASS1T1; DASS2T1; DASS3T1; DASS4T1; DASS5T1; DASS6T1; DASS7T1; DASS8T1; DASS9T1; DASS10T1; DASS11T1; DASS12T1; DASS13T1; DASS14T1; DASS15T1; DASS16T1; DASS17T1,"Official quarantine table, not the user-provided zip, contains the expected music-intervention chemotherapy data."
RCTC-02282,rct_expansion/provenance/manual_review_user_files_2026_06_11/extracted/doi-10.34894-bazoqf/Data,Data,57,8,Patient_Recode,25,32,Allocation,Ketamine=23; Midazolam=19; Saline=15,MRRpre; VRRpre; VTVpre; MRRpost; VRRpost; VTVpost,Patient_Recode; Allocation; MRRpre; VRRpre; VTVpre; MRRpost; VRRpost; VTVpost,"Rows are repeated within patient IDs, so cleaning should reconcile repeated measurements to the publication-aligned participant-level estimand."
RCTC-00064,rct_expansion/provenance/manual_review_user_files_2026_06_11/extracted/RCTC-00064/Raw Data.sav,Raw Data.sav,250,122,ID,250,0,Randomization,1.0=125; 2.0=125,AF; AFnumber; AFepisode; OnsetAF; HospStay; CICUstay; HDUstay,Randomization; ID; AF; Withdraw; AGE; GENDER; ETHNIC; Euroscore; BMI; BMIGroup; BMIGroup2; NYHA; LEFTAT_SIZE; RIGHTATsize; EF; DM; HPT; ASTHMA; COPD; CKD; HYPERCHOL; SMOKER; ALCOHOL; Smokergrp; alcoholgrp; XCLAMPTIME; BYPASSTIME; ISOLATED; Distal; DistalGroup; Ventilation; CICUstay; HDUstay; HospStay; AFnumber; AFepisode; OnsetAF; OnsetAFGrp; filter_$; Reintubation; Stroke; Sternalinfect; Respiratory; Renalfailure; Endocrine; PleuralEffusion; Tamponade; Fever; Hyperkal; others; Death; MI; LegWound; GI; PRE_1; PRE_2; PRE_3; PRE_4; PRE_5; PRE_6; PRE_7; PRE_8; PRE_9; PRE_10; PRE_11; PRE_12; PRE_13; PRE_14; PRE_15; PRE_16; PRE_17; PRE_18; PREACEinhibitor; PREAngiotensinReceptorBlocker; PRECalciumChannelBlocker; PREBetaBlocker; PREOtherAntihypertensives; PREAspirin; PREClopidogrel; PREOtherantiplatelets,Same 250x122 structure and variables as active trial82/RCTC-01411 Raw Data Tocovid.tab; AF coding differs only in missing value representation.
RCTC-05010,rct_expansion/provenance/manual_review_user_files_2026_06_11/RCTC-05010.xlsx,ITT_analysis set,86,190,SUBJECT,86,0,GROUP,CRB+rTMS=30; CRB+SHM=28; PLC+SHM=28,VISDTC_1; MOTS_1; PSCNUM_1; PSSCNUM_1; PSSINUM_1; CWTTM1_1; CWTTM2_1; CWTTM3_1; SCWT_W-D_1; SCWT_C-D_1; DGFRES_1; DGBRES_1; TMRES01_1; TMT1_1_truncated; TMRES05_1; TMT2_1_truncated; HDTS_1; HARTS_1; RTISMRT_1; RTIFMRT_1; MTTTC01_1; MTTTC02_1; OTS01_1; OTS02_1; VISDTC_2; D_PRESDT_VISDTC_2; MOTS_2; PSCNUM_2; PSSCNUM_2; PSSINUM_2,SUBJECT; GROUP; PRESDT; VISDTC_1; BRTHDT; AGE; SEX; MOTS_1; PSCNUM_1; PSSCNUM_1; PSSINUM_1; CWTTM1_1; CWTTM2_1; CWTTM3_1; SCWT_W-D_1; SCWT_C-D_1; DGFRES_1; DGBRES_1; TMRES01_1; TMT1_1_truncated; TMRES05_1; TMT2_1_truncated; HDTS_1; HARTS_1; RTISMRT_1; RTIFMRT_1; MTTTC01_1; MTTTC02_1; OTS01_1; OTS02_1; VISDTC_2; D_PRESDT_VISDTC_2; VISDTC_2_PROTOCOL_DIFF; MOTS_2; PSCNUM_2; PSSCNUM_2; PSSINUM_2; CWTTM1_2; CWTTM2_2; CWTTM3_2; SCWT_W-D_2; SCWT_C-D_2; DGFRES_2; DGBRES_2; TMRES01_2; TMT1_2_truncated; TMRES05_2; TMT2_2_truncated; HDTS_2; HARTS_2; RTISMRT_2; RTIFMRT_2; MTTTC01_2; MTTTC02_2; OTS01_2; OTS02_2; VISDTC_3; D_PRESDT_VISDTC_3; VISDTC_3_PROTOCOL_DIFF; MOTS_3; z_MOTS_3; PSCNUM_3; z_PSCNUM_3; PSSCNUM_3; z_PSSCNUM_3; PSSINUM_3; z_PSSINUM_3; CWTTM1_3; z_CWTTM1_3; CWTTM2_3; z_CWTTM2_3; CWTTM3_3; z_CWTTM3_3; SCWT_W-D_2.1; z_SCWT_W-D_2; SCWT_C-D_2.1; z_SCWT_C-D_2; DGFRES_3; z_DGFRES_3; DGBRES_3,Workbook also contains a CRF_variables dictionary sheet.
