candidate_id,title,doi,repository,qualification_decision,final_queue,access_bucket,downloaded_file_count,download_failed_count,registered_file_count,archive_extracted_file_count,readable_table_count,license_status,publication_status,randomization_status,crossover_status,participant_level_status,treatment_assignment_status,outcome_status,reasons,best_readable_tables,treatment_evidence,outcome_evidence,metadata_error_summary,failed_download_errors,next_action
RCTC-03141,"Supplementary information files for ""Exercise as an anti-inflammatory therapy in Axial Spondyloarthritis Therapeutic Intervention (EXTASI) study: a randomized controlled trial""",10.17028/rd.lboro.28286774.v1,Loughborough University,needs_manual_review_before_cleaning,needs_manual_review_before_cleaning,downloaded_or_inspected,1,0,1,0,0,pass,pass,pass,no,unclear_or_fail,unclear_or_fail,unclear_or_fail,participant-level rows not confirmed; treatment/group assignment not confirmed; outcomes not confirmed,,,,,,Manual file/publication review before any cleaning.
RCTC-05660,Data for: Effects of Dieting Associated with Combined aerobic and Resistance Training program on Body Composition and Cardiovascular Disease Risk Factors among Obese Students with Metabolic Syndrome,10.17632/j22h832thx,Mendeley,needs_manual_review_before_cleaning,needs_manual_review_before_cleaning,downloaded_or_inspected,2,0,2,0,0,pass,pass,pass,no,unclear_or_fail,unclear_or_fail,unclear_or_fail,participant-level rows not confirmed; treatment/group assignment not confirmed; outcomes not confirmed,,,,,,Manual file/publication review before any cleaning.
RCTC-02585,Supplemental Material - A Randomized Controlled Trial Analyzing Nonthermal Atmospheric Plasma for the Treatment of Verruca Vulgaris in Pediatric Patients,10.17632/dm2y8ztgvm,Mendeley Data,needs_manual_review_before_cleaning,needs_manual_review_before_cleaning,downloaded_or_inspected,1,0,1,0,0,pass,pass,pass,no,unclear_or_fail,unclear_or_fail,unclear_or_fail,participant-level rows not confirmed; treatment/group assignment not confirmed; outcomes not confirmed,,,,,,Manual file/publication review before any cleaning.
RCTC-05335,Supplemental Material: Bimekizumab demonstrated a favorable safety profile and high levels of efficacy with up to 2 years of treatment in patients with moderate to severe hidradenitis suppurativa,10.17632/8bjtsp9cf2.2,Mendeley Data,needs_manual_review_before_cleaning,needs_manual_review_before_cleaning,downloaded_or_inspected,1,0,1,0,0,pass,pass,pass,no,unclear_or_fail,unclear_or_fail,unclear_or_fail,participant-level rows not confirmed; treatment/group assignment not confirmed; outcomes not confirmed,,,,,,Manual file/publication review before any cleaning.
RCTC-03255,Data From: ChatGPT versus expert feedback on clinical reasoning questions and their effect on learning: a randomized controlled trial,10.5281/zenodo.13769970,Zenodo,needs_manual_review_before_cleaning,needs_manual_review_before_cleaning,downloaded_or_inspected,4,0,4,0,4,pass,unclear,pass,no,pass,pass,pass,associated publication not linked/clear in metadata,Immediate Test.xlsx:Immediate Test rows>=115 cols=20 | Pre-Intervention Survey on Critical Approach to AI.xlsx:Survey rows>=86 cols=10 | Delayed Test.xlsx:Delayed Test rows>=115 cols=20 | Post-Intervention Survey on Critical Approach to AI.xlsx:Survey rows>=86 cols=10,Group: 0:Control(ExpertFeedback) 1:Intervention(ChatGPTFeedback) | Group: 0:Control(ExpertFeedback) 1:Intervention(ChatGPTFeedback) | Group: 0:Control(ExpertFeedback) 1:Intervention(ChatGPTFeedback) | Group: 0:Control(ExpertFeedback) 1:Intervention(ChatGPTFeedback),"Total Score - Uncomplicated UTI; Total Score - Complicated UTI; Total Score - Pyelonephritis; Total Score - Immediate Test | If the information provided by AI conflicts with my own existing knowledge, I accept the information provided by AI as correct. | Total Score - Uncomplicated UTI; Total Score - Complicated UTI; Total Score - Pyelonephritis; Total Score - Delayed Test | If the information provided by AI conflicts with my own existing knowledge, I accept the information provided by AI as correct.",,,Manual file/publication review before any cleaning.
RCTC-01119,SGLT2-Inhibition reverts urinary peptide changes associated with severe COVID-19: an in-silico proof-of-principle of proteomics-based drug repurposing,10.5281/zenodo.5464139,Zenodo,needs_manual_review_before_cleaning,needs_manual_review_before_cleaning,downloaded_or_inspected,1,0,1,0,0,pass,unclear,unclear_or_fail,no,unclear_or_fail,unclear_or_fail,unclear_or_fail,associated publication not linked/clear in metadata; individual randomization not confirmed by metadata; participant-level rows not confirmed; treatment/group assignment not confirmed; outcomes not confirmed,,,,,,Manual file/publication review before any cleaning.
RCTC-03406,The Efficacy of Daily versus Weekly Ferrous Sulfate in Maintaining Normal Serum Ferritin Levels During Pregnancy: A Randomized Controlled Trial,10.5281/zenodo.13128548,Zenodo,needs_manual_review_before_cleaning,needs_manual_review_before_cleaning,downloaded_or_inspected,1,0,1,0,1,pass,unclear,pass,no,pass,pass,pass,associated publication not linked/clear in metadata,dr oyebamiji gynec (1).sav:sav rows>=240 cols=43,bloodgroup; rhesusgroup; treatment,hospitalnos; bloodgroup; birthweight; postpartumPCV; changeserumferrinting,,,Manual file/publication review before any cleaning.
